{
  "schema_version": 1,
  "validation_id": "bsp-0.8.4-20260801-01",
  "bsp_version": "0.8.4",
  "repository_commit": "8f3d3cbac641ff5febfefeabc5426878857b4e11",
  "validation_date": "2026-08-01",
  "operator": "Fuyuki Yoneyama",
  "overall_status": "pending",
  "hardware": {
    "product": "PicoCalc",
    "board_revision": "",
    "mcu": "RP2040",
    "notes": "Prepared for the next MusicPlayer playback evidence log. Board revision and SD identification are not recorded yet. The 0.8.4 audio ring change is the core1 producer/core0 DMA IRQ SPSC accounting fix described in bsp/README.md."
  },
  "software": {
    "pico_sdk": "2.2.0",
    "compiler": "arm-none-eabi-gcc 13.2.1",
    "cmake": "3.28.3"
  },
  "sd_card": {
    "manufacturer": "",
    "model": "",
    "capacity": "",
    "filesystem": "FAT32"
  },
  "firmware": {
    "path": "build/PicoCalc_MusicPlayer.uf2",
    "uf2_sha256": "abab2474f23c3206d19e951cfae776fa92e868e147427fb3c4a39c65c6c8fb97",
    "build_log": ""
  },
  "tests": {
    "lcd": {
      "status": "pending",
      "observed": "Awaiting the shared MusicPlayer playback evidence log; the 0.8.3 intermittent LCD readback result remains a separate known BSP issue.",
      "evidence_files": []
    },
    "sd": {
      "status": "pending",
      "observed": "Awaiting the shared MusicPlayer playback evidence log. No formatting or destructive SD preparation is required.",
      "evidence_files": []
    },
    "keyboard": {
      "status": "pending",
      "observed": "Awaiting the shared MusicPlayer playback evidence log.",
      "evidence_files": []
    }
  },
  "notes": "The next MusicPlayer playback log must record the 0.8.4 PCM stream path, including underrun, clip, drop, ring level, the Phase 9 cross-core invariant, and the audible result. Audio evidence remains in notes rather than the canonical BSP tests schema. App version: 0.3.18-v1-core0-ring-prefill. Build timestamp: 2026-08-01T00:00:00Z."
}
