{
  "schema_version": 1,
  "validation_id": "bsp-0.8.8-20260802-01",
  "bsp_version": "0.8.8",
  "repository_commit": "d60af46a00e85a1dc639c6b8b342ade774a544e0",
  "validation_date": "2026-08-02",
  "operator": "Fuyuki Yoneyama",
  "overall_status": "pending",
  "hardware": {
    "product": "PicoCalc",
    "board_revision": "",
    "mcu": "RP2040",
    "notes": "Shared MusicPlayer validation completed for SD and audio on this board. BSP 0.8.8 removes two per-sample divisions using a bit-identical wrap-255 reconstruction expression; it does not change PWM duty values or the audio format. Board revision and SD identity remain unavailable."
  },
  "software": {
    "pico_sdk": "2.2.0",
    "compiler": "arm-none-eabi-gcc 13.2.1",
    "cmake": "3.28.3"
  },
  "sd_card": {
    "manufacturer": "",
    "model": "",
    "capacity": "",
    "filesystem": "FAT32"
  },
  "firmware": {
    "path": "build/PicoCalc_MusicPlayer.uf2",
    "uf2_sha256": "890f3ee293115b9d6fc1c91bb379c563e939507624a19420d46af163db66df3b",
    "build_log": "diagnostic Release build, pio-rgb565, timestamp 2026-08-02T09:00:00Z, app 1.1.4-midi-pitch-throughput"
  },
  "tests": {
    "lcd": {
      "status": "pending",
      "observed": "Awaiting the shared MusicPlayer playback evidence log; the intermittent LCD readback result remains a separate known BSP issue.",
      "evidence_files": []
    },
    "sd": {
      "status": "pass",
      "observed": "MusicPlayer log pico20260802_181946.log: filesystem smoke status=pass, nested /MUSIC enumeration entries=4, io_errors=0, MP3 and MIDI read/parse reached EOF. Existing music assets were not formatted, renamed, moved, or deleted.",
      "evidence_files": []
    },
    "keyboard": {
      "status": "pending",
      "observed": "Awaiting the shared MusicPlayer playback evidence log.",
      "evidence_files": []
    }
  },
  "notes": "Audio evidence remains in notes rather than the canonical BSP tests schema. Evidence log /home/fuyuki/pico_dvl/codex/log/pico20260802_181946.log has SHA-256 b70ea8c125dd5537df049c1abab609fd4413348eedbe48373fbc179b1a9c54d7. Full MIDI playback produced 3549641 samples with underrun=0, clip=0, drop=0, min_ring=256, max_supply_gap_us=2100, service_rate_sps=52171, and source_eof=1; the operator reported recognizable music, chords, correct speed, and no interruptions. The Host test compares all 256 duty values with the former division expression, and RP2040 disassembly confirms that write_sample() no longer calls integer division. overall_status remains pending because LCD readback, keyboard interaction, board revision, and SD identity are not closed by this run."
}
